{
  "id": "golden-content-02-words",
  "schema": "renderinggen.job",
  "version": 1,
  "render_plan": {
    "schema": "chronon.render-plan",
    "version": 1,
    "job_id": "golden-content-02-words",
    "canvas": { "width": 1280, "height": 720, "fps_num": 30, "fps_den": 1, "duration_frames": 150 },
    "layers": [
      {
        "id": "background",
        "type": "image",
        "asset": "assets/background.jpg",
        "box_width": 1280,
        "box_height": 720,
        "fit": "cover",
        "start_frame": 0,
        "duration_frames": 150
      },
      {
        "id": "important_word_1",
        "type": "text",
        "text": "ELON MUSK",
        "preset": "active_word_pop",
        "start_frame": 15,
        "duration_frames": 30,
        "animation": { "preset": "scale_drop" }
      },
      {
        "id": "important_word_2",
        "type": "text",
        "text": "TESLA",
        "preset": "active_word_pop",
        "start_frame": 45,
        "duration_frames": 30,
        "animation": { "preset": "fade_in" }
      },
      {
        "id": "important_word_3",
        "type": "text",
        "text": "$10 BILLION",
        "preset": "active_word_pop",
        "start_frame": 75,
        "duration_frames": 30,
        "animation": { "preset": "fade_shift_vertical" }
      },
      {
        "id": "important_word_4",
        "type": "text",
        "text": "OPENAI",
        "preset": "active_word_pop",
        "start_frame": 105,
        "duration_frames": 30,
        "animation": { "preset": "scale_drop" }
      }
    ],
    "output": { "path": "result.mp4", "format": "mp4", "codec": "h264" }
  },
  "assets": [
    {
      "hash": "52209ee36928dba960583179922a54acf045d52d44c3128c517425d4baaa4f78",
      "logical_path": "assets/background.jpg"
    },
    {
      "hash": "690243adfefe0ce154b547db6205794bd30ac4277275179517a90994f4980648",
      "logical_path": "assets/fonts/DejaVuSans.ttf"
    }
  ]
}
