{
  "id": "golden-content-01-phrases",
  "schema": "renderinggen.job",
  "version": 1,
  "render_plan": {
    "schema": "chronon.render-plan",
    "version": 1,
    "job_id": "golden-content-01-phrases",
    "canvas": { "width": 1280, "height": 720, "fps": 30, "duration_frames": 150 },
    "layers": [
      {
        "id": "background",
        "type": "image",
        "asset": "assets/background.jpg",
        "box_width": 1280,
        "box_height": 720,
        "fit": "cover",
        "start_frame": 0,
        "duration_frames": 150
      },
      {
        "id": "important_phrase_1",
        "type": "text",
        "text": "A MAJOR CHANGE",
        "preset": "caption_card",
        "start_frame": 24,
        "duration_frames": 48
      },
      {
        "id": "important_phrase_2",
        "type": "text",
        "text": "THIS CHANGES EVERYTHING",
        "preset": "caption_card",
        "start_frame": 90,
        "duration_frames": 54
      }
    ],
    "output": { "path": "result.mp4", "format": "mp4", "codec": "h264" }
  },
  "assets": [
    {
      "hash": "52209ee36928dba960583179922a54acf045d52d44c3128c517425d4baaa4f78",
      "logical_path": "assets/background.jpg"
    },
    {
      "hash": "690243adfefe0ce154b547db6205794bd30ac4277275179517a90994f4980648",
      "logical_path": "assets/fonts/DejaVuSans.ttf"
    }
  ]
}
